PMID	Text
25674387	Fragile X syndrome as a rare disease in China - Therapeutic challenges and opportunities.         Drug development, FMR1, Fragile X syndrome, Translational science, mGluR5 Recognized as the most common inherited from of intellectual disability (ID) and the most common known monogenic cause of autism spectrum disorders (ASD), Fragile X syndrome (FXS) is identified as an unmet medical need for the development of personalized medicine and targeted therapeutics for neurodevelopment disorders as a result of improved understanding of the genetic and cellular mechanisms. Consequently promising pharmacological targets have emerged from basic and translational research, are now being pursued by global pharmaceutical and biotech companies in early proof-of-concept clinical trials. With the world's largest rare disease population, China potentially has a large number of FXS patients, many of whom are under-diagnosed or even misdiagnosed, barely with any treatment. In spite of improved awareness of FXS in recent years, big gaps still exist between China and developed countries in multiple aspects. With increased public awareness, strong government support and investment, coupled with an increasingly large number of Western-trained experienced researchers engaging in new drug discovery and development, China has the potential to become an important player in the discovery of effective diagnostics and treatments for a rare disease like FXS.         
25679778	Deletion of Fmr1 alters function and synaptic inputs in the auditory brainstem.          Fragile X Syndrome (FXS), a neurodevelopmental disorder, is the most prevalent single-gene cause of autism spectrum disorder. Autism has been associated with impaired auditory processing, abnormalities in the auditory brainstem response (ABR), and reduced cell number and size in the auditory brainstem nuclei. FXS is characterized by elevated cortical responses to sound stimuli, with some evidence for aberrant ABRs. Here, we assessed ABRs and auditory brainstem anatomy in Fmr1-/- mice, an animal model of FXS. We found that Fmr1-/- mice showed elevated response thresholds to both click and tone stimuli. Amplitudes of ABR responses were reduced in Fmr1-/- mice for early peaks of the ABR. The growth of the peak I response with sound intensity was less steep in mutants that in wild type mice. In contrast, amplitudes and response growth in peaks IV and V did not differ between these groups. We did not observe differences in peak latencies or in interpeak latencies. Cell size was reduced in Fmr1-/- mice in the ventral cochlear nucleus (VCN) and in the medial nucleus of the trapezoid body (MNTB). We quantified levels of inhibitory and excitatory synaptic inputs in these nuclei using markers for presynaptic proteins. We measured VGAT and VGLUT immunolabeling in VCN, MNTB, and the lateral superior olive (LSO). VGAT expression in MNTB was significantly greater in the Fmr1-/- mouse than in wild type mice. Together, these observations demonstrate that FXS affects peripheral and central aspects of hearing and alters the balance of excitation and inhibition in the auditory brainstem.         
21220020	A mouse model of the fragile X premutation: effects on behavior, dendrite morphology, and regional rates of cerebral protein synthesis.          Carriers of FMR1 premutation alleles have 55-200 CGG repeats in the 5' untranslated region of the gene. These individuals are at risk for fragile X associated primary ovarian insufficiency (females) and, in late life, fragile X associated tremor and ataxia syndrome (males, and to a lesser extent, females). Premutation carrier status can also be associated with autism spectrum disorder, attention deficit hyperactivity disorder, and some cognitive deficits. In premutation carriers, FMR1 mRNA levels are often higher than those with normal sized alleles. In contrast, in subjects with full mutation alleles, (>200 repeats) the FMR1 gene is silenced and FMR1 mRNA and its product, FMRP, are absent. We have studied a male knock-in (KI) mouse model of the fragile X premutation (120-140 repeats) during young adulthood. In comparison to wild type, KI mice were hyperactive, exhibited less anxiety in both the open field and the elevated zero maze, were impaired on the passive avoidance test, and showed some subtle deficits on a test of social interaction. Motor learning as assessed by the rotarod test was normal. Dendritic arbors were less complex and spine densities and lengths increased in medial prefrontal cortex, basal lateral amygdala, and hippocampus compared with wild type. Regional rates of cerebral protein synthesis measured in vivo in KI mice were increased. KI mice also had elevated levels of Fmr1 mRNA and decreased levels of FMRP. Our results highlight similarities in phenotype between KI and Fmr1 knockout mice and suggest that the decreased concentration of FMRP contributes to the phenotype in young adult KI mice.          
22483044	The pathophysiology of fragile X (and what it teaches us about synapses).          Fragile X is the most common known inherited cause of intellectual disability and autism, and it typically results from transcriptional silencing of FMR1 and loss of the encoded protein, FMRP (fragile X mental retardation protein). FMRP is an mRNA-binding protein that functions at many synapses to inhibit local translation stimulated by metabotropic glutamate receptors (mGluRs) 1 and 5. Recent studies on the biology of FMRP and the signaling pathways downstream of mGluR1/5 have yielded deeper insight into how synaptic protein synthesis and plasticity are regulated by experience. This new knowledge has also suggested ways that altered signaling and synaptic function can be corrected in fragile X, and human clinical trials based on this information are under way.        
22483378	Fragile X syndrome: mechanistic insights and therapeutic avenues regarding the role of potassium channels.          Fragile X syndrome (FXS) is a common form of mental disability and one of the known causes of autism. The mutation responsible for FXS is a large expansion of the trinucleotide CGG repeats that leads to DNA methylation of the fragile X mental retardation gene 1 (FMR1) and transcriptional silencing, resulting in the absence of fragile X mental retardation protein (FMRP), an mRNA binding protein. Although it is widely known that FMRP is critical for metabotropic glutamate receptor (mGluR)-dependent long-term depression (LTD), which has provided a general theme for developing pharmacological drugs for FXS, specific downstream targets of FMRP may also be of therapeutic value. Since alterations in potassium channel expression level or activity could underlie neuronal network defects in FXS, here we describe recent findings on how these channels might be altered in mouse models of FXS and the possible therapeutic avenues for treating FXS.          
19799873	Lithium ameliorates altered glycogen synthase kinase-3 and behavior in a mouse model of fragile X syndrome.          Fragile X syndrome (FXS), the most common form of inherited mental retardation and a genetic cause of autism, results from mutated fragile X mental retardation-1 (Fmr1). This study examined the effects on glycogen synthase kinase-3 (GSK3) of treatment with a metabotropic glutamate receptor (mGluR) antagonist, MPEP, and the GSK3 inhibitor, lithium, in C57Bl/6 Fmr1 knockout mice. Increased mGluR signaling may contribute to the pathology of FXS, and the mGluR5 antagonist MPEP increased inhibitory serine-phosphorylation of brain GSK3 selectively in Fmr1 knockout mice but not in wild-type mice. Inhibitory serine-phosphorylation of GSK3 was lower in Fmr1 knockout, than wild-type, mouse brain regions and was increased by acute or chronic lithium treatment, which also increased hippocampal brain-derived neurotrophic factor levels. Fmr1 knockout mice displayed alterations in open-field activity, elevated plus-maze, and passive avoidance, and these differences were ameliorated by chronic lithium treatment. These findings support the hypothesis that impaired inhibition of GSK3 contributes to the pathogenesis of FXS and support GSK3 as a potential therapeutic target.        
24207117	"The roles of FMRP-regulated genes in autism spectrum disorder: single- and multiple-hit genetic etiologies.          Autism spectrum disorder (ASD) is a highly heritable complex neurodevelopmental condition characterized by impairments in social interaction and communication and restricted and repetitive behaviors. Although roles for both de novo and familial genetic variation have been documented, the underlying disease mechanisms remain poorly elucidated. In this study, we defined and explored distinct etiologies of genetic variants that affect genes regulated by Fragile-X mental retardation protein (FMRP), thought to play a key role in neuroplasticity and neuronal translation, in ASD-affected individuals. In particular, we developed the Trend test, a pathway-association test that is able to robustly detect multiple-hit etiologies and is more powerful than existing approaches. Exploiting detailed spatiotemporal maps of gene expression within the human brain, we identified four discrete FMRP-target subpopulations that exhibit distinct functional biases and contribute to ASD via different types of genetic variation. We also demonstrated that FMRP target genes are more likely than other genes with similar expression patterns to contribute to disease. We developed the hypothesis that FMRP targets contribute to ASD via two distinct etiologies: (1) ultra-rare and highly penetrant single disruptions of embryonically upregulated FMRP targets (""single-hit etiology"") or (2) the combination of multiple less penetrant disruptions of nonembryonic, synaptic FMRP targets (""multiple-hit etiology""). The Trend test provides rigorous support for a multiple-hit genetic etiology in a subset of autism cases and is easily extendible to combining information from multiple types of genetic variation (i.e., copy-number and exome variants), increasing its value to next-generation sequencing approaches.           "
20032969	Repetitive self-grooming behavior in the BTBR mouse model of autism is blocked by the mGluR5 antagonist MPEP.          Autism is a neurodevelopmental disorder characterized by abnormal reciprocal social interactions, communication deficits, and repetitive behaviors with restricted interests. BTBR T+tf/J (BTBR) is an inbred mouse strain that shows robust behavioral phenotypes with analogies to all three of the diagnostic symptoms of autism, including well-replicated deficits in reciprocal social interactions and social approach, unusual patterns of ultrasonic vocalization, and high levels of repetitive self-grooming. These phenotypes offer straightforward behavioral assays for translational investigations of pharmacological compounds. Two suggested treatments for autism were evaluated in the BTBR mouse model. Methyl-6-phenylethynyl-pyridine (MPEP), an antagonist of the mGluR5 metabotropic glutamate receptor, blocks aberrant phenotypes in the Fmr1 mouse model of Fragile X, a comorbid neurodevelopmental disorder with autistic features. Risperidone has been approved by the United States Food and Drug Administration for the treatment of irritability, tantrums, and self-injurious behavior in autistic individuals. We evaluated the actions of MPEP and risperidone on two BTBR phenotypes, low sociability and high repetitive self-grooming. Open field activity served as an independent control for non-social exploratory activity and motor functions. C57BL/6J (B6), an inbred strain with high sociability and low self-grooming, served as the strain control. MPEP significantly reduced repetitive self-grooming in BTBR, at doses that had no sedating effects on open field activity. Risperidone reduced repetitive self-grooming in BTBR, but only at doses that induced sedation in both strains. No overall improvements in sociability were detected in BTBR after treatment with either MPEP or risperidone. Our findings suggest that antagonists of mGluR5 receptors may have selective therapeutic efficacy in treating repetitive behaviors in autism.        
29970983	Common Defects of Spine Dynamics and Circuit Function in Neurodevelopmental Disorders: A Systematic Review of Findings From         in Vivo Optical Imaging of Mouse Models. autism spectrum disorders (ASDs), calcium imaging, dendritic spines, excitatory-inhibitory balance, serotonin, two-photon imaging In vivo optical imaging is a powerful tool for revealing brain structure and function at both the circuit and cellular levels. Here, we provide a systematic review of findings obtained from in vivo imaging studies of mouse models of neurodevelopmental disorders, including the monogenic disorders fragile X syndrome, Rett syndrome, and Angelman syndrome, which are caused by genetic abnormalities of FMR1, MECP2, and UBE3A, as well as disorders caused by copy number variations (15q11-13 duplication and 22q11.2 deletion) and BTBR mice as an inbred strain model of autism spectrum disorder (ASD). Most studies visualize the structural and functional responsiveness of cerebral cortical neurons to sensory stimuli and the developmental and experience-dependent changes in these responses as a model of brain functions affected by these disorders. The optical imaging techniques include two-photon microscopy of fluorescently labeled dendritic spines or neurons loaded with fluorescent calcium indicators and macroscopic imaging of cortical activity using calcium indicators, voltage-sensitive dyes or intrinsic optical signals. Studies have revealed alterations in the density, stability, and turnover of dendritic spines, aberrant cortical sensory responses, impaired inhibitory function, and concomitant failure of circuit maturation as common causes for neurological deficits. Mechanistic hypotheses derived from in vivo imaging also provide new directions for therapeutic interventions. For instance, it was recently demonstrated that early postnatal administration of a selective serotonin reuptake inhibitor (SSRI) restores impaired cortical inhibitory function and ameliorates the aberrant social behaviors in a mouse model of ASD. We discuss the potential use of SSRIs for treating ASDs in light of these findings.
29984470	Imaging genetics in neurodevelopmental psychopathology.         ADHD, ASD, ID, brain imaging genetics, neurodevelopmental disorders Neurodevelopmental disorders are defined by highly heritable problems during development and brain growth. Attention-deficit/hyperactivity disorder (ADHD), autism spectrum disorders (ASDs), and intellectual disability (ID) are frequent neurodevelopmental disorders, with common comorbidity among them. Imaging genetics studies on the role of disease-linked genetic variants on brain structure and function have been performed to unravel the etiology of these disorders. Here, we reviewed imaging genetics literature on these disorders attempting to understand the mechanisms of individual disorders and their clinical overlap. For ADHD and ASD, we selected replicated candidate genes implicated through common genetic variants. For ID, which is mainly caused by rare variants, we included genes for relatively frequent forms of ID occurring comorbid with ADHD or ASD. We reviewed case-control studies and studies of risk variants in healthy individuals. Imaging genetics studies for ADHD were retrieved for SLC6A3/DAT1, DRD2, DRD4, NOS1, and SLC6A4/5HTT. For ASD, studies on CNTNAP2, MET, OXTR, and SLC6A4/5HTT were found. For ID, we reviewed the genes FMR1, TSC1 and TSC2, NF1, and MECP2. Alterations in brain volume, activity, and connectivity were observed. Several findings were consistent across studies, implicating, for example, SLC6A4/5HTT in brain activation and functional connectivity related to emotion regulation. However, many studies had small sample sizes, and hypothesis-based, brain region-specific studies were common. Results from available studies confirm that imaging genetics can provide insight into the link between genes, disease-related behavior, and the brain. However, the field is still in its early stages, and conclusions about shared mechanisms cannot yet be drawn.          
28955201	Fragile X-Associated Diminished Ovarian Reserve and Primary Ovarian Insufficiency from Molecular Mechanisms to Clinical Manifestations.         FMR1 premutation carriers, diminished ovarian reserve, fragile X syndrome, fragile-X-associated diminished ovarian reserve, fragile-X-associated primary ovarian insufficiency Fragile X syndrome (FXS), is caused by a loss-of-function mutation in the         FMR1 gene located on the X-chromosome, which leads to the most common cause of inherited intellectual disability in males and the leading single-gene defect associated with autism. A full mutation (FM) is represented by more than 200 CGG repeats within the FMR1 gene, resulting in FXS. A FM is inherited from women carrying a FM or a premutation (PM; 55-200 CGG repeats) allele. PM is associated with phenotypes distinct from those associated with FM. Some manifestations of the PM are unique; fragile-X-associated tremor/ataxia syndrome (FXTAS), and fragile-X-associated primary ovarian insufficiency (FXPOI), while others tend to be non-specific such as intellectual disability. In addition, women carrying a PM may suffer from subfertility or infertility. There is a need to elucidate whether the impairment of ovarian function found in PM carriers arises during the primordial germ cell (PGC) development stage, or due to a rapidly diminishing oocyte pool throughout life or even both. Due to the possibility of expansion into a FM in the next generation, and other ramifications, carrying a PM can have an enormous impact on one's life; therefore, preconception counseling for couples carrying the PM is of paramount importance. In this review, we will elaborate on the clinical manifestations in female PM carriers and propose the definition of fragile-X-associated diminished ovarian reserve (FXDOR), then we will review recent scientific findings regarding possible mechanisms leading to FXDOR and FXPOI. Lastly, we will discuss counseling, preventative measures and interventions available for women carrying a PM regarding different aspects of their reproductive life, fertility treatment, pregnancy, prenatal testing, contraception and fertility preservation options.
28960184	Fragile X syndrome.          Fragile X syndrome (FXS) is the leading inherited form of intellectual disability and autism spectrum disorder, and patients can present with severe behavioural alterations, including hyperactivity, impulsivity and anxiety, in addition to poor language development and seizures. FXS is a trinucleotide repeat disorder, in which >200 repeats of the CGG motif in FMR1 leads to silencing of the gene and the consequent loss of its product, fragile X mental retardation 1 protein (FMRP). FMRP has a central role in gene expression and regulates the translation of potentially hundreds of mRNAs, many of which are involved in the development and maintenance of neuronal synaptic connections. Indeed, disturbances in neuroplasticity is a key finding in FXS animal models, and an imbalance in inhibitory and excitatory neuronal circuits is believed to underlie many of the clinical manifestations of this disorder. Our knowledge of the proteins that are regulated by FMRP is rapidly growing, and this has led to the identification of multiple targets for therapeutic intervention, some of which have already moved into clinical trials or clinical practice.        
20981777	The behavioral phenotype of FMR1 mutations.          The purpose of this article is to provide an overview of the behavioral phenotype of FMR1 mutations, including fragile X syndrome (FXS) in order to better understand the clinical involvement of individuals affected by mutations in this gene. FXS is associated with a wide range of intellectual and behavioral problems, some relatively mild and others quite severe. FXS is the most common cause of inherited intellectual disability and one of the most prevalent genetic causes of autism spectrum disorder. Learning difficulties, attentional problems, anxiety, aggressive behavior, stereotypies, and mood disorders are also frequent in FXS. Recent studies of children and adults have identified associations between FMR1 premutation and many of the same disorders. We examine the neurobehavioral phenotypes of FXS and FMR1 premutation as they manifest across the lifespan of the individual.          
27638450	Altered nocifensive behavior in animal models of autism spectrum disorder: The role of the nicotinic cholinergic system.         Autism, BTBR, Nicotine, Nicotine (PubChem CID: 89594), Nicotinic, Nociception, Nocifensive, Pain, Saccharin (PubChem CID: 656582), Social behavior, nAChR Caretakers and clinicians alike have long recognized that individuals with autism spectrum disorder (ASD) can have altered sensory processing, which can contribute to its core symptoms. However, the pathobiology of sensory alterations in ASD is poorly understood. Here we examined nocifensive behavior in ASD mouse models, the BTBR T          +Itpr3tf/J (BTBR) and the fragile-X mental retardation-1 knockout (Fmr1-KO) mice. We also examined the effects of nicotine on nocifensive behavior given that nicotine, a nicotinic cholinergic receptor (nAChR) agonist that has antinociceptive effects, was shown to improve social deficits and decrease repetitive behaviors in BTBR mice. Compared to respective controls, both BTBR and Fmr1-KO had hyporesponsiveness to noxious thermal stimuli and electrical stimulation of C-sensory fibers, normal responsiveness to electrical stimulation of Aβ- and Aδ-fiber, and hyperresponsiveness to visceral pain after acetic acid intraperitoneal injection. In BTBR, nicotine at lower doses increased, whereas at higher doses, it decreased hotplate latency compared to vehicle. In a significantly different effect pattern, in control mice, nicotine had antinociceptive effects to noxious heat only at the high dose. Interestingly, these nocifensive behavior alterations and differential responses to nicotine antinociceptive effects in BTBR mice were associated with significant downregulation of α3, α4, α5, α7, β2, β3, and β4 nAChR subunits in several cerebral regions both, during embryonic development and adulthood. Taken together, these findings further implicate nAChRs in behaviors alterations in the BTBR model and lend support to the hypothesis that nAChRs may be a target for treatment of behavior deficits and sensory dysfunction in ASD.
27643697	Changes in insulin-like growth factor signaling alter phenotypes in Fragile X Mice.         AKT signaling, ERK signaling, Fragile X syndrome, IGF1, IGF1R, IGF2, Insulin-like growth factors, autism spectrum disorders, model mice, signaling pathways Fragile X syndrome (FXS) is an inherited form of intellectual disability that is usually caused by expansion of a polymorphic CGG repeat in the 5' untranslated region of the X-linked FMR1 gene, which leads to hypermethylation and transcriptional silencing. Two non-neurological phenotypes of FXS are enlarged testes and connective tissue dysplasia, which could be caused by alterations in a growth factor signaling pathway. FXS patients also frequently have autistic-like symptoms, suggesting that the signaling pathways affected in FXS may overlap with those affected in autism. Identifying these pathways is important for both understanding the effects of FMR1 inactivation and developing treatments for both FXS and autism. Here we show that decreasing the levels of the insulin-like growth factor (Igf) receptor 1 corrects a number of phenotypes in the mouse model of FXS, including macro-orchidism, and that increasing the levels of IGF2 exacerbates the seizure susceptibility phenotype. These results suggest that the pathways altered by the loss of the FMR1-encoded protein (FMRP) may overlap with the pathways affected by changes in Igf signaling or that one or more of the proteins that play a role in Igf signaling could interact with FMRP. They also indicate a new set of potential targets for drug treatment of FXS and autism spectrum disorders.          
