PMID	Text
23464607	An investigation of narrative ability in boys with autism and fragile X syndrome.          Whereas pragmatic language difficulties are characteristic of both autism and Fragile X syndrome, it is unclear whether such deficits are qualitatively similar or whether certain skills are differentially affected. This study compared narrative competence in boys with autism, Fragile X syndrome, Down syndrome, and typical development. Results revealed that an interaction between diagnosis and nonverbal mental age predicted narrative microstructure (e.g., complex syntax) but not macrostructure (e.g., thematic maintenance). Correlations with FMR1-related variation were investigated in children with Fragile X syndrome. While CGG repeat length was associated with many language characteristics, nonverbal IQ appeared to mediate these relationships. These findings are an important step toward understanding narrative abilities in boys with and without the FMR1 mutation.        
15362161	"Plasticity of nonneuronal brain tissue: roles in developmental disorders.          Neuronal and nonneuronal plasticity are both affected by environmental and experiential factors. Remodeling of existing neurons induced by such factors has been observed throughout the brain, and includes alterations in dendritic field dimensions, synaptogenesis, and synaptic morphology. The brain loci affected by these plastic neuronal changes are dependent on the type of experience and learning. Increased neurogenesis in the hippocampal dentate gyrus is a well-documented response to environmental complexity (""enrichment"") and learning. Exposure to challenging experiences and learning opportunities also alters existing glial cells (i.e., astrocytes and oligodendrocytes), and up-regulates gliogenesis, in the cerebral cortex and cerebellum. Such glial plasticity often parallels neuronal remodeling in both time and place, and this enhanced morphological synergism may be important for optimizing the functional interaction between glial cells and neurons. Aberrant structural plasticity of nonneuronal elements is a contributing factor, as is aberrant neuron plasticity, to neurological and developmental disorders such as epilepsy, autism, and mental retardation (i.e., fragile X syndrome). Some of these nonneuronal pathologies include abnormal cerebral and cerebellar white matter and myelin-related proteins in autism; abnormal myelin basic protein in fragile X syndrome (FXS); and abnormal astrocytes in autism, FXS, and epilepsy. A number of recent studies demonstrate the possibility of using environmental and experiential intervention to reduce or ameliorate some of the neuronal and nonneuronal abnormalities, as well as behavioral deficits, present in these neurological and developmental disorders.        "
26516618	Persistent astrocyte activation in the fragile X mouse cerebellum.         Astrogliosis, FMRP, GFAP, LIF, S100B, TNFR2, autism, myelin, oligodendrocyte precursor cells Fragile X Syndrome, the most common single gene cause of autism, results from loss of the RNA-binding protein FMRP. Although FMRP is highly expressed in neurons, it has also recently been identified in glia. It has been postulated that in the absence of FMRP, abnormal function of non-neuronal cells may contribute to the pathogenesis of the disorder. We previously demonstrated reduced numbers of oligodendrocyte precursor cells and delayed myelination in the cerebellum of fragile X (Fmr1) knockout mice.          
12655491	Self-injurious behavior in young boys with fragile X syndrome.          In this study, we distributed surveys to 67 families of young boys with fragile X syndrome to determine the prevalence, onset, form, function, location, and correlates of self-injurious behavior. Fifty-five surveys were completed (82%). The mean age of the boys at the time of the survey was 80 months (range = 20-144). Self-injurious behavior (SIB) was reported for 58% of the participants with a mean age of onset of 31 months. The mean number of forms of self-injury was 2 per participant. Biting was the most commonly reported form of self-injury with the fingers and back of the hand disproportionately targeted as the most prevalent self-injury body site. There was no linear increase in risk of SIB with age past 25 months. SIB was reported as most likely to occur following the presentation of difficult task demands or changes in routine. Significant group differences were found between overall ratings of problem behavior for boys with self-injury compared to those without self-injury. Groups did not differ on measures of fragile X mental retardation protein (FMRP), autism status, adaptive behavior, or age first medicated. Results are discussed in terms of future research designed to further elucidate the behavioral phenotype of fragile X syndrome.          
7977358	Molecular analysis and test of linkage between the FMR-1 gene and infantile autism in multiplex families.          Approximately 2%-5% of autistic children show cytogenetic evidence of the fragile X syndrome. This report tests whether infantile autism in multiplex autism families arises from an unusual manifestion of the fragile X syndrome. This could arise either by expansion of the (CGG)n trinucleotide repeat in FMR-1 or from a mutation elsewhere in the gene. We studied 35 families that met stringent criteria for multiplex autism. Amplification of the trinucleotide repeat and analysis of methylation status were performed in 79 autistic children and in 31 of their unaffected siblings, by Southern blot analysis. No examples of amplified repeats were seen in the autistic or control children or in their parents or grandparents. We next examined the hypothesis that there was a mutation elsewhere in the FMR-1 gene, by linkage analysis in 32 of these families. We tested four different dominant models and a recessive model. Linkage to FMR-1 could be excluded (lod score between -24 and -62) in all models by using probes DXS548, FRAXAC1, and FRAXAC2 and the CGG repeat itself. Tests for heterogeneity in this sample were negative, and the occurrence of positive lod scores in this data set could be attributed to chance. Analysis of the data by the affected-sib method also did not show evidence for linkage of any marker to autism. These results enable us to reject the hypothesis that multiplex autism arises from expansion of the (CGG)n trinucleotide repeat in FMR-1.(ABSTRACT TRUNCATED AT 250 WORDS)        
30385191	Increased severity of fragile X spectrum disorders in the agricultural community of Ricaurte, Colombia.         Colombia, FXPOI, FXTAS, Fragile X spectrum disorders, Fragile X syndrome Premutation carriers of the FMR1 gene (CGG repeats between 55 and 200) usually have normal intellectual abilities but approximately 20% are diagnosed with developmental problems or autism spectrum disorder. Additionally, close to 50% have psychiatric problems such as anxiety, ADHD and/or depression. The spectrum of fragile X disorders also includes Fragile-X-associated primary ovarian insufficiency (FXPOI) in female carriers and Fragile-X-associated tremor/ataxia syndrome (FXTAS) in older male and female carriers. We evaluated 25 premutation carriers in the rural community of Ricaurte Colombia and documented all behavioral problems, social deficits and clinical signs of FXPOI and FXTAS as well as reviewed the medical and obstetric history. We found an increased frequency and severity of symptoms of fragile X spectrum disorders, which might be related to the vulnerability of FMR1 premutation carriers to higher exposure to neurotoxic pesticides in this rural community.          
19325170	The state of synapses in fragile X syndrome.          Fragile X syndrome (FXS) is the most common inherited form of mental retardation and a leading genetic cause of autism. There is increasing evidence in both FXS and other forms of autism that alterations in synapse number, structure, and function are associated and contribute to these prevalent diseases. FXS is caused by loss of function of the Fmr1 gene, which encodes the RNA binding protein, fragile X mental retardation protein (FMRP). Therefore, FXS is a tractable model to understand synaptic dysfunction in cognitive disorders. FMRP is present at synapses where it associates with mRNA and polyribosomes. Accumulating evidence finds roles for FMRP in synapse development, elimination, and plasticity. Here, the authors review the synaptic changes observed in FXS and try to relate these changes to what is known about the molecular function of FMRP. Recent advances in the understanding of the molecular and synaptic function of FMRP, as well as the consequences of its loss, have led to the development of novel therapeutic strategies for FXS.        
26022075	Putative Microcircuit-Level Substrates for Attention Are Disrupted in Mouse Models of Autism.         Acetylcholine, Calcium imaging, Fragile X syndrome, GCaMP, Prefrontal cortex, Valproic acid Deep layer excitatory circuits in the prefrontal cortex represent the strongest locus for genetic convergence in autism, but specific abnormalities within these circuits that mediate key features of autism, such as cognitive or attentional deficits, remain unknown. Attention normally increases the sensitivity of neural populations to incoming signals by decorrelating ongoing cortical circuit activity. Here, we investigated whether mechanisms underlying this phenomenon might be disrupted within deep layer prefrontal circuits in mouse models of autism.          
26026973	Deciphering discord: How Drosophila research has enhanced our understanding of the importance of FMRP in different spatial and temporal contexts.         Circadian behavior, Drosophila, Fragile X, Memory, Neurogenesis Fragile X Syndrome (FXS) is the most common heritable form of intellectual impairment as well as the leading monogenetic cause of autism. In addition to its canonical definition as a neurodevelopmental disease, recent findings in the clinic suggest that FXS is a systemic disorder that is characterized by a variety of heterogeneous phenotypes. Efforts to study FXS pathogenesis have been aided by the development and characterization of animal models of the disease. Research efforts in Drosophila melanogaster have revealed key insights into the mechanistic underpinnings of FXS. While much remains unknown, it is increasingly apparent that FXS involves a myriad of spatially and temporally specific alterations in cellular function. Consequently, the literature is filled with numerous discordant findings. Researchers and clinicians alike must be cognizant of this dissonance, as it will likely be important for the design of preclinical studies to assess the efficacy of therapeutic strategies to improve the lives of FXS patients.           
19996900	Broad clinical involvement in a family affected by the fragile X premutation.          The mutations in the FMR1 gene have been described as a family of disorders called fragile X-associated disorders including fragile X syndrome, fragile X-associated tremor/ataxia syndrome, primary ovarian insufficiency, and other problems associated with the premutation, such as hypothyroidism, hypertension, neuropathy, anxiety, depression, attention-deficit hyperactivity disorders, and autism spectrum disorders. The premutation is relatively common in the general population affecting 1 of 130 to 250 female individuals and 1 of 250 to 800 male individuals. Therefore, to provide appropriate treatment and genetic counseling for all of the carriers and affected individuals in a family, a detailed family history that reviews many of the disorders that are related to both the premutation and the full mutation should be carried out as exemplified in these cases. To facilitate the integration of this knowledge into clinical practice, this is the first case report that demonstrates only premutation involvement across 3 generations.        
25271084	MBD5 haploinsufficiency is associated with sleep disturbance and disrupts circadian pathways common to Smith-Magenis and fragile X syndromes.          Individuals with autism spectrum disorders (ASD) who have an identifiable single-gene neurodevelopmental disorder (NDD), such as fragile X syndrome (FXS, FMR1), Smith-Magenis syndrome (SMS, RAI1), or 2q23.1 deletion syndrome (del 2q23.1, MBD5) share phenotypic features, including a high prevalence of sleep disturbance. We describe the circadian deficits in del 2q23.1 through caregiver surveys in which we identify several frequent sleep anomalies, including night/early awakenings, coughing/snoring loudly, and difficulty falling asleep. We couple these findings with studies on the molecular analysis of the circadian deficits associated with haploinsufficiency of MBD5 in which circadian gene mRNA levels of NR1D2, PER1, PER2, and PER3 were altered in del 2q23.1 lymphoblastoid cell lines (LCLs), signifying that haploinsufficiency of MBD5 can result in dysregulation of circadian rhythm gene expression. These findings were further supported by expression microarrays of MBD5 siRNA knockdown cells that showed significantly altered expression of additional circadian rhythm signaling pathway genes. Based on the common sleep phenotypes observed in del 2q23.1, SMS, and FXS patients, we explored the possibility that MBD5, RAI1, and FMR1 function in overlapping circadian rhythm pathways. Bioinformatic analysis identified conserved putative E boxes in MBD5 and RAI1, and expression levels of NR1D2 and CRY2 were significantly reduced in patient LCLs. Circadian and mTOR signaling pathways, both associated with sleep disturbance, were altered in both MBD5 and RAI1 knockdown microarray data, overlapping with findings associated with FMR1. These data support phenotypic and molecular overlaps across these syndromes that may be exploited to provide therapeutic intervention for multiple disorders.         
25278957	Clinical and molecular implications of mosaicism in FMR1 full mutations.         FMR1, FMRP, fragile X, methylation, mosaicism, premutation Expansions of more than 200 CGG repeats (full mutation) in the FMR1 gene give rise to fragile X syndrome (FXS) through a process that generally involves hypermethylation of the FMR1 promoter region and gene silencing, resulting in absence of expression of the encoded protein, FMRP. However, mosaicism with alleles differing in size and extent of methylation often exist within or between tissues of individuals with FXS. In the current work, CGG-repeat lengths and methylation status were assessed for eighteen individuals with FXS, including 13 mosaics, for which peripheral blood cells (PBMCs) and primary fibroblast cells were available. Our results show that for both PBMCs and fibroblasts, FMR1 mRNA and FMRP expression are directly correlated with the percent of methylation of the FMR1 allele. In addition, Full Scale IQ scores were inversely correlated with the percent methylation and positively correlated with higher FMRP expression. These latter results point toward a positive impact on cognition for full mutation mosaics with lower methylation compared to individuals with fully methylated, full mutation alleles. However, we did not observe a significant reduction in the number of seizures, nor in the severity of hyperactivity or autism spectrum disorder, among individuals with mosaic genotypes in the presentation of FXS. These observations suggest that low, but non-zero expression of FMRP may be sufficient to positively impact cognitive function in individuals with FXS, with methylation mosaicism (lowered methylation fraction) contributing to a more positive clinical outcome.         
25284784	De novo insertions and deletions of predominantly paternal origin are associated with autism spectrum disorder.          Whole-exome sequencing (WES) studies have demonstrated the contribution of de novo loss-of-function single-nucleotide variants (SNVs) to autism spectrum disorder (ASD). However, challenges in the reliable detection of de novo insertions and deletions (indels) have limited inclusion of these variants in prior analyses. By applying a robust indel detection method to WES data from 787 ASD families (2,963 individuals), we demonstrate that de novo frameshift indels contribute to ASD risk (OR = 1.6; 95% CI = 1.0-2.7; p = 0.03), are more common in female probands (p = 0.02), are enriched among genes encoding FMRP targets (p = 6 × 10(-9)), and arise predominantly on the paternal chromosome (p < 0.001). On the basis of mutation rates in probands versus unaffected siblings, we conclude that de novo frameshift indels contribute to risk in approximately 3% of individuals with ASD. Finally, by observing clustering of mutations in unrelated probands, we uncover two ASD-associated genes: KMT2E (MLL5), a chromatin regulator, and RIMS1, a regulator of synaptic vesicle release.          
28012946	Impaired GABAergic inhibition in the hippocampus of Fmr1 knockout mice.         Fmr1 knockout mice, Fragile X syndrome, GABA(A) receptor subunit, Hippocampus, Inhibitory postsynaptic current Many clinical and molecular features of the fragile X syndrome, a common form of intellectual disability and autism, can be modeled by deletion of the Fmr1 protein (Fmrp) in mice. Previous studies showed a decreased expression of several components of the GABAergic system in Fmr1 knockout mice. Here, we used this mouse model to investigate the functional consequences of Fmrp deletion on hippocampal GABAergic inhibition in the CA1-region of the hippocampus. Whole-cell patch-clamp recordings demonstrated a significantly reduced amplitude of evoked inhibitory postsynaptic currents (eIPSCs) and a decrease in the amplitude and frequency of spontaneous IPSCs. In addition, miniature IPSCs were reduced in amplitude and frequency and decayed significantly slower than mIPSCs in controls. Quantitative real-time PCR revealed a significantly lower expression of α2, β1 and δ GABA          A receptor subunits in the hippocampus of the juvenile mice (P22) compared to wild-type littermates. Correspondingly, we found also at the protein level reduced amounts of α2, β1 and δ subunits in Fmr1 knockout mice. Overall, these results demonstrate that the reduction in several components of the GABAergic system is already present at young age and that this reduction results in measurable abnormalities on GABAA receptor-mediated phasic inhibition. These abnormalities might contribute to the behavioral and cognitive deficits of this fragile X mouse model.
29844802	Assessment of efficacy of prenatal genetic diagnosis for fragile X syndrome using nested PCR.         CGG repeat, FMR1, fragile X syndrome, nested polymerase chain reaction Fragile X syndrome (FXS) is the most common inherited cause of intellectual disability and the leading monogenic cause of autism spectrum disorder. It has previously been demonstrated that prenatal genetic diagnosis is efficient for the diagnosis of FXS. The present study investigated the diagnostic effects of nested polymerase chain reaction (PCR) for fragile X mental retardation 1 (FMR1) and expanded CGG repeats. It was demonstrated that the nested PCR assay rapidly measured the multi-copies of the         FMR1 gene in individual samples. The nested PCR assay detected normal CGG repeat lengths and expanded CGG repeat lengths with a low occurrence of false positives. In addition, the nested PCR assay resulted in increased sensitivity and specificity for patients with FXS. Furthermore, the nested PCR assay identified the mutation and generated conclusive cases for FXS, indicating that this assay is beneficial for the diagnosis of FXS patients. In conclusion, these outcomes indicate that nested PCR assay is a reliable and easier method for diagnosis of FXS, which may be used for the diagnosis of FXS patients.
20014373	Treatments for fragile X syndrome: a closer look at the data.          Research into the determinants and developmental course of fragile X syndrome (FXS) has made remarkable progress over the last 25 years. However, treatments to ameliorate the symptoms of FXS have been less forthcoming. While there is optimism in the field that the pace of intervention research is quickening, there has been a bias toward psychopharmacological approaches to treatment. A closer look at the data from those investigations reveals a paucity of evidence that medications can improve intellectual and adaptive functioning in FXS, or decrease associated behavioral and/or emotional issues. Work in other related disorders (e.g., autism) has shown that dramatic improvements in intellectual and adaptive functioning, as well as behavioral and emotional problems, can occur if intensive behavioral treatment is begun early in the child's life. It is hoped that future research efforts will evaluate these intensive early intervention strategies in children with FXS, perhaps in combination with pharmacological approaches.        
29036014	A family with two cases of melanocytic tumors and fragile X syndrome.          Fragile X syndrome (FXS), a leading cause of inherited intellectual disability, most commonly results from an expansion of the CGG trinucleotide repeat in the fragile X mental retardation 1 (FMR1) gene to more than 200 copies (full mutation). The FXS phenotype differs by sex and is associated with intellectual and cognitive impairment, characteristic physical features, epilepsy, and/or behavioral challenges including autism spectrum disorder. In this patient population, tumors involving blood cells, digestive organs, the central nervous system, and testes have been described, but melanocytic tumors have not been reported. Here, we describe two maternal cousins with FXS, one of whom has melanoma and the other has atypical nevus syndrome. We discuss possible mechanisms leading to this unusual or possibly coincidental association and the difficulties in the optimal treatment of FXS patients.        
29038238	Delayed Maturation of Fast-Spiking Interneurons Is Rectified by Activation of the TrkB Receptor in the Mouse Model of Fragile X Syndrome.         TrkB, critical period, fast-spiking interneuron, fragile X syndrome, somatosensory cortex, synapse Fragile X syndrome (FXS) is a neurodevelopmental disorder that is a leading cause of inherited intellectual disability, and the most common known cause of autism spectrum disorder. FXS is broadly characterized by sensory hypersensitivity and several developmental alterations in synaptic and circuit function have been uncovered in the sensory cortex of the mouse model of FXS (          Fmr1 KO). GABA-mediated neurotransmission and fast-spiking (FS) GABAergic interneurons are central to cortical circuit development in the neonate. Here we demonstrate that there is a delay in the maturation of the intrinsic properties of FS interneurons in the sensory cortex, and a deficit in the formation of excitatory synaptic inputs on to these neurons in neonatal Fmr1 KO mice. Both these delays in neuronal and synaptic maturation were rectified by chronic administration of a TrkB receptor agonist. These results demonstrate that the maturation of the GABAergic circuit in the sensory cortex is altered during a critical developmental period due in part to a perturbation in BDNF-TrkB signaling, and could contribute to the alterations in cortical development underlying the sensory pathophysiology of FXS.SIGNIFICANCE STATEMENT Fragile X (FXS) individuals have a range of sensory related phenotypes, and there is growing evidence of alterations in neuronal circuits in the sensory cortex of the mouse model of FXS (Fmr1 KO). GABAergic interneurons are central to the correct formation of circuits during cortical critical periods. Here we demonstrate a delay in the maturation of the properties and synaptic connectivity of interneurons in Fmr1 KO mice during a critical period of cortical development. The delays both in cellular and synaptic maturation were rectified by administration of a TrkB receptor agonist, suggesting reduced BDNF-TrkB signaling as a contributing factor. These results provide evidence that the function of fast-spiking interneurons is disrupted due to a deficiency in neurotrophin signaling during early development in FXS.
29040407	Genetic Reduction of Matrix Metalloproteinase-9 Promotes Formation of Perineuronal Nets Around Parvalbumin-Expressing Interneurons and Normalizes Auditory Cortex Responses in Developing Fmr1 Knock-Out Mice.          Abnormal sensory responses associated with Fragile X Syndrome (FXS) and autism spectrum disorders include hypersensitivity and impaired habituation to repeated stimuli. Similar sensory deficits are also observed in adult Fmr1 knock-out (KO) mice and are reversed by genetic deletion of Matrix Metalloproteinase-9 (MMP-9) through yet unknown mechanisms. Here we present new evidence that impaired development of parvalbumin (PV)-expressing inhibitory interneurons may underlie hyper-responsiveness in auditory cortex of Fmr1 KO mice via MMP-9-dependent regulation of perineuronal nets (PNNs). First, we found that PV cell development and PNN formation around GABAergic interneurons were impaired in developing auditory cortex of Fmr1 KO mice. Second, MMP-9 levels were elevated in P12-P18 auditory cortex of Fmr1 KO mice and genetic reduction of MMP-9 to WT levels restored the formation of PNNs around PV cells. Third, in vivo single-unit recordings from auditory cortex neurons showed enhanced spontaneous and sound-driven responses in developing Fmr1 KO mice, which were normalized following genetic reduction of MMP-9. These findings indicate that elevated MMP-9 levels contribute to the development of sensory hypersensitivity by influencing formation of PNNs around PV interneurons suggesting MMP-9 as a new therapeutic target to reduce sensory deficits in FXS and potentially other autism spectrum disorders.        
