PMID	Text
18398441	Fragile X syndrome.          Fragile X syndrome, an X-linked dominant disorder with reduced penetrance, is associated with intellectual and emotional disabilities ranging from learning problems to mental retardation, and mood instability to autism. It is most often caused by the transcriptional silencing of the FMR1 gene, due to an expansion of a CGG repeat found in the 5'-untranslated region. The FMR1 gene product, FMRP, is a selective RNA-binding protein that negatively regulates local protein synthesis in neuronal dendrites. In its absence, the transcripts normally regulated by FMRP are over translated. The resulting over abundance of certain proteins results in reduced synaptic strength due to AMPA receptor trafficking abnormalities that lead, at least in part, to the fragile X phenotype.        
18410169	"Evidence for social anxiety and impaired social cognition in a mouse model of fragile X syndrome.          This study assessed social behavior in a mouse model of Fragile X syndrome (FXS), the Fmr1 (tm1Cgr) or Fmr1 ""knockout"" (KO) mouse. Both the KO and wild-type (WT) mice preferred to be near a novel conspecific than to be alone. However, during the initial interaction with a novel conspecific, (1) a greater proportion of the KO mice exhibited high levels of grooming; and (2) the average duration of nose contact with the stimulus mouse was significantly shorter for the KO mice, both indicative of increased arousal and/or anxiety. Both groups exhibited a robust novelty preference when the novel animal was a ""preferred"" mouse. However, when the novel mouse was a ""nonpreferred"" animal, both groups showed a diminished novelty preference but this effect was more pronounced for the WT mice. This blunted negative reaction of the KO mice to a nonpreferred animal may indicate that they were less proficient than controls in distinguishing between positive and negative social interactions. These findings provide support for the use of this animal model to study the autistic features of FXS and autism spectrum disorders.        "
18410188	Social behavior phenotypes in fragile X syndrome, autism, and the Fmr1 knockout mouse: theoretical comment on McNaughton et al. (2008).          Comments on the article by C. H. McNaughton et al.. Individuals with fragile X syndrome (FXS) show varying degrees of social behavior disturbances, from social anxiety to autism. This variability of social behavior phenotypes in FXS is likely to be due to interactions of Fmr1 with other gene variants and environmental factors during brain development, although very little is known about the specific genetic and neural mechanisms involved. The Fmr1 knockout mouse is an important experimental resource for elucidating the neural mechanisms of social anxiety, social reward, and social cognition. However, studies of social behavior phenotypes in the Fmr1 knockout mouse are still in early stages. McNaughton et al provide important new information on these phenotypes in the Fmr1 knockout mouse through their use of novel, detailed behavioral analysis to identify signs of increased social anxiety and social cognition deficits. Their significant refinements in measurement of social behavior phenotypes will help to advance future efforts to elucidate the genetic and neural mechanisms underlying social behavior disturbances in FXS and autism.        
25979787	Endocannabinoid-mediated improvement on a test of aversive memory in a mouse model of fragile X syndrome.         FAAH, Fmr1 KO mice, Fragile X syndrome, Memory, Passive avoidance, Propofol Silencing the gene FMR1 in fragile X syndrome (FXS) with consequent loss of its protein product, FMRP, results in intellectual disability, hyperactivity, anxiety, seizure disorders, and autism-like behavior. In a mouse model (Fmr1 knockout (KO)) of FXS, a deficit in performance on the passive avoidance test of learning and memory is a robust phenotype. We report that drugs acting on the endocannabinoid (eCB) system can improve performance on this test. We present three lines of evidence: (1) Propofol (reported to inhibit fatty acid amide hydrolase (FAAH) activity) administered 30 min after training on the passive avoidance test improved performance in Fmr1 KO mice but had no effect on wild type (WT). FAAH catalyzes the metabolism of the eCB, anandamide, so its inhibition should result in increased anandamide levels. (2) The effect of propofol was blocked by prior administration of the cannabinoid receptor 1 antagonist AM-251. (3) Treatment with the FAAH inhibitor, URB-597, administered 30 min after training on the passive avoidance test also improved performance in Fmr1 KO mice but had no effect on WT. Our results indicate that the eCB system is involved in FXS and suggest that the eCB system is a promising target for treatment of FXS.          
25986746	Therapeutic Strategies in Fragile X Syndrome: From Bench to Bedside and Back.          Fragile X syndrome (FXS), an inherited intellectual disability often associated with autism, is caused by the loss of expression of the fragile X mental retardation protein. Tremendous progress in basic, preclinical, and translational clinical research has elucidated a variety of molecular-, cellular-, and system-level defects in FXS. This has led to the development of several promising therapeutic strategies, some of which have been tested in larger-scale controlled clinical trials. Here, we will summarize recent advances in understanding molecular functions of fragile X mental retardation protein beyond the well-known role as an mRNA-binding protein, and will describe current developments and emerging limitations in the use of the FXS mouse model as a preclinical tool to identify therapeutic targets. We will review the results of recent clinical trials conducted in FXS that were based on some of the preclinical findings, and discuss how the observed outcomes and obstacles will inform future therapy development in FXS and other autism spectrum disorders.         
23254376	Rescue of dendritic spine phenotype in Fmr1 KO mice with the mGluR5 antagonist AFQ056/Mavoglurant.          Fragile X syndrome (FXS) is the leading monogenic cause of intellectual disability and autism. The disease is a result of lack of expression of the fragile X mental retardation protein. Brain tissues of patients with FXS and mice with FMRP deficiency have shown an abnormal dendritic spine phenotype. We investigated the dendritic spine length and density of hippocampal CA1 pyramidal neurons in 2-, 10-, and 25-week-old Fmr1 knockout (KO). Next, we studied the effects of long-term treatment with an mGluR5 antagonist, AFQ056/Mavoglurant, on the spine phenotype in adult Fmr1 KO mice. We observed alterations in the spine phenotype during development, with a decreased spine length in 2-week-old Fmr1 KO mice compared with age-match wild-type littermates, but with increased spine length in Fmr1 KO mice compared with 10- and 25-week-old wild-type controls. No difference was found in spine density at any age. We report a rescue of the abnormal spine length in adult Fmr1 KO mice after a long-term treatment with AFQ056/Mavoglurant. This finding suggests that long-term treatment at later stage is sufficient to reverse the structural spine abnormalities and represents a starting point for future studies aimed at improving treatments for FXS.        
23260144	Multiple autism-linked genes mediate synapse elimination via proteasomal degradation of a synaptic scaffold PSD-95.          The activity-dependent transcription factor myocyte enhancer factor 2 (MEF2) induces excitatory synapse elimination in mouse neurons, which requires fragile X mental retardation protein (FMRP), an RNA-binding protein implicated in human cognitive dysfunction and autism. We report here that protocadherin 10 (Pcdh10), an autism-spectrum disorders gene, is necessary for this process. MEF2 and FMRP cooperatively regulate the expression of Pcdh10. Upon MEF2 activation, PSD-95 is ubiquitinated by the ubiquitin E3 ligase murine double minute 2 (Mdm2) and then binds to Pcdh10, which links it to the proteasome for degradation. Blockade of the Pcdh10-proteasome interaction inhibits MEF2-induced PSD-95 degradation and synapse elimination. In FMRP-lacking neurons, elevated protein levels of eukaryotic translation elongation factor 1 α (EF1α), an Mdm2-interacting protein and FMRP target mRNA, sequester Mdm2 and prevent MEF2-induced PSD-95 ubiquitination and synapse elimination. Together, our findings reveal roles for multiple autism-linked genes in activity-dependent synapse elimination.          
26322075	"Changes in expression of the long non-coding RNA FMR4 associate with altered gene expression during differentiation of human neural precursor cells.         FMR4, Fragile X, MBD4, chromatin remodeling, differentiation, epigenetics, intellectual disability, lncRNA CGG repeat expansions in the Fragile X mental retardation 1 (FMR1) gene are responsible for a family of associated disorders characterized by either intellectual disability and autism Fragile X Syndrome (FXS), or adult-onset neurodegeneration Fragile X-associated Tremor/Ataxia Syndrome. However, the FMR1 locus is complex and encodes several long non-coding RNAs, whose expression is altered by repeat expansion mutations. The role of these lncRNAs is thus far unknown; therefore we investigated the functionality of FMR4, which we previously identified. ""Full""-length expansions of the FMR1 triplet repeat cause silencing of both FMR1 and FMR4, thus we are interested in potential loss-of-function that may add to phenotypic manifestation of FXS. Since the two transcripts do not exhibit cis-regulation of one another, we examined the potential for FMR4 to regulate target genes at distal genomic loci using gene expression microarrays. We identified FMR4-responsive genes, including the methyl-CpG-binding domain protein 4 (MBD4). Furthermore, we found that in differentiating human neural precursor cells, FMR4 expression is developmentally regulated in opposition to expression of both FMR1 (which is expected to share a bidirectional promoter with FMR4) and MBD4. We therefore propose that FMR4's function is as a gene-regulatory lncRNA and that this transcript may function in normal development. Closer examination of FMR4 increases our understanding of the role of regulatory lncRNA and the consequences of FMR1 repeat expansions.         "
26110222	Hyperactivity and lack of social discrimination in the adolescent Fmr1 knockout mouse.          The aims of this study were to investigate behaviour relevant to human autism spectrum disorder (ASD) and the fragile X syndrome in adolescent Fmr1 knockout (KO) mice and to evaluate the tissue levels of striatal monoamines. Fmr1 KO mice were evaluated in the open field, marble burying and three-chamber test for the presence of hyperactivity, anxiety, repetitive behaviour, sociability and observation of social novelty compared with wild-type (WT) mice. The Fmr1 KO mice expressed anxiety and hyperactivity in the open field compared with WT mice. This increased level of hyperactivity was confirmed in the three-chamber test. Fmr1 KO mice spent more time with stranger mice compared with the WT. However, after a correction for hyperactivity, their apparent increase in sociability became identical to that of the WT. Furthermore, the Fmr1 KO mice could not differentiate between a familiar or a novel mouse. Monoamines were measured by HPLC: Fmr1 KO mice showed an increase in the striatal dopamine level. We conclude that the fragile X syndrome model seems to be useful for understanding certain aspects of ASD and may have translational interest for studies of social behaviour when hyperactivity coexists in ASD patients.         
20804589	Taurine regulation of short term synaptic plasticity in fragile X mice.          Fragile X Syndrome is the most common known genetic cause of autism. The Fmr1-KO mouse, lacks the fragile X mental retardation protein (FMRP), and is used as a model of the syndrome. The core behavioral deficits of autism may be conceptualized either as excessive adherence to patterns as seen in repetitive actions and aberrant language, or as insensitivity to subtle but socially important changes in patterns. The hippocampus receives information from the entorhinal cortex and plays a crucial role in the processing of patterned information. To gain more insight into the physiological function of FMRP and the neuronal mechanisms underlying fragile X syndrome, we examined the electrophysiological response of the hippocampus to pair pulse stimulation as a measure of patterned information processing and how it is affected in the Fmr1-KO mouse.          
20809278	Autoimmune disease in mothers with the FMR1 premutation is associated with seizures in their children with fragile X syndrome.          An increased prevalence of autoimmune diseases in family members of children with autism spectrum disorders (ASD) has been previously reported. ASD is also a common problem co-occurring in children with fragile X syndrome (FXS). Why ASD occurs in some individuals with FXS, but not all, is largely unknown. Furthermore, in premutation carrier mothers, there is an increased risk for autoimmune diseases. This study compared the rate of ASD and other neurodevelopmental/behavioral problems in 61 children with FXS born to 41 carrier mothers who had autoimmune disease and in 97 children with FXS of 78 carrier mothers who did not have autoimmune disease. There were no significant differences in the mean age (9.61 ± 5.59 vs. 9.41 ± 6.31, P = 0.836), cognitive and adaptive functioning in children of mothers with and without autoimmune disease. Among children whose mothers had autoimmune disease, the odds ratio (OR) for ASD was 1.27 (95% CI 0.62-2.61, P = 0.5115). Interestingly, the OR for seizures and tics was 3.81 (95% CI 1.13-12.86, P = 0.031) and 2.94 (95% CI 1.19-7.24, P = 0.019), respectively, in children of mothers with autoimmune disease compared to children of mothers without autoimmune disease. In conclusion, autoimmune disease in carrier mothers was not associated with the presence of ASD in their children. However, seizures and tics were significantly increased in children of mothers with autoimmune disease. This suggests a potential new mechanism of seizure and tic exacerbation in FXS related to an intergenerational influence from autoimmunity in the carrier mother.        
30126171	Drosophila as a Model for Assessing the Function of RNA-Binding Proteins during Neurogenesis and Neurological Disease. C9orf72, Drosophila, FUS, Fmr1, RNA-binding proteins, TDP-43, amyotrophic lateral sclerosis, brat, neurodegeneration, neurons, shep, spinal muscular atrophy An outstanding question in developmental neurobiology is how RNA processing events contribute to the regulation of neurogenesis. RNA processing events are increasingly recognized as playing fundamental roles in regulating multiple developmental events during neurogenesis, from the asymmetric divisions of neural stem cells, to the generation of complex and diverse neurite morphologies. Indeed, both asymmetric cell division and neurite morphogenesis are often achieved by mechanisms that generate asymmetric protein distributions, including post-transcriptional gene regulatory mechanisms such as the transport of translationally silent messenger RNAs (mRNAs) and local translation of mRNAs within neurites. Additionally, defects in RNA splicing have emerged as a common theme in many neurodegenerative disorders, highlighting the importance of RNA processing in maintaining neuronal circuitry. RNA-binding proteins (RBPs) play an integral role in splicing and post-transcriptional gene regulation, and mutations in RBPs have been linked with multiple neurological disorders including autism, dementia, amyotrophic lateral sclerosis (ALS), spinal muscular atrophy (SMA), Fragile X syndrome (FXS), and X-linked intellectual disability disorder. Despite their widespread nature and roles in neurological disease, the molecular mechanisms and networks of regulated target RNAs have been defined for only a small number of specific RBPs. This review aims to highlight recent studies in         Drosophila that have advanced our knowledge of how RBP dysfunction contributes to neurological disease.
30132892	Inhibition of GluN2A NMDA receptors ameliorates synaptic plasticity deficits in the Fmr1        -/y mouse model. Autism, Developmental Disability, Fragile X syndrome, GluN2A, Glutamate receptors, Intellectual Disability, Synaptic plasticity, neuropsychiatric diseases, tri-heteromeric NMDA receptors Fragile X syndrome (FXS) is a genetic condition that is the most common form of inherited intellectual impairment and causes a range of neurodevelopmental complications including learning disabilities and intellectual disability and shares many characteristics with autism spectrum disorder (ASD). In the FXS mouse model, Fmr1          -/y , impaired synaptic plasticity was restored by pharmacologically inhibiting GluN2A-containing NMDA receptors but not GluN2B-containing receptors. Similar results were obtained by crossing Fmr1-/y with GluN2A knock-out (Grin2A-/- ) mice. These results suggest that dampening the elevated levels of GluN2A-containing NMDA receptors in Fmr1-/y mice has the potential to restore hyperexcitability of the neural circuitry to (a more) normal-like level of brain activity.
30135642	Stress Odorant Sensory Response Dysfunction in         Drosophila Fragile X Syndrome Mutants. Drosophila, Fragile X syndrome, IBMX, avoidance response, cAMP, cGMP, sensory response dysfunction Sensory processing dysfunction (SPD) is present in most patients with intellectual disability (ID) and autism spectrum disorder (ASD). Silencing expression of the Fragile X mental retardation 1 (        FMR1) gene leads to Fragile X syndrome (FXS), the most common single gene cause of ID and ASD. Drosophila have a highly conserved FMR1 ortholog, dfmr1. dfmr1 mutants display cognitive and social defects reminiscent of symptoms seen in individuals with FXS. We utilized a robust behavioral assay for sensory processing of the Drosophila stress odorant (dSO) to gain a better understanding of the molecular basis of SPD in FXS. Here, we show that dfmr1 mutant flies present significant defects in dSO response. We found that dfmr1 expression in mushroom bodies is required for dSO processing. We also show that cyclic adenosine monophosphate (cAMP) signaling via PKA is activated after exposure to dSO and that several drugs regulating both cAMP and cyclic guanosine monophosphate (cGMP) levels significantly improved defects in dSO processing in dfmr1 mutant flies.
30137253	Involvement of Phosphodiesterase 2A Activity in the Pathophysiology of Fragile X Syndrome.          The fragile X mental retardation protein (FMRP) is an RNA-binding protein involved in translational regulation of mRNAs that play key roles in synaptic morphology and plasticity. The functional absence of FMRP causes the fragile X syndrome (FXS), the most common form of inherited intellectual disability and the most common monogenic cause of autism. No effective treatment is available for FXS. We recently identified the Phosphodiesterase 2A (Pde2a) mRNA as a prominent target of FMRP. PDE2A enzymatic activity is increased in the brain of Fmr1-KO mice, a recognized model of FXS, leading to decreased levels of cAMP and cGMP. Here, we pharmacologically inhibited PDE2A in Fmr1-KO mice and observed a rescue both of the maturity of dendritic spines and of the exaggerated hippocampal mGluR-dependent long-term depression. Remarkably, PDE2A blockade rescued the social and communicative deficits of both mouse and rat Fmr1-KO animals. Importantly, chronic inhibition of PDE2A in newborn Fmr1-KO mice followed by a washout interval, resulted in the rescue of the altered social behavior observed in adolescent mice. Altogether, these results reveal the key role of PDE2A in the physiopathology of FXS and suggest that its pharmacological inhibition represents a novel therapeutic approach for FXS.        
23148316	Dampened dopamine-mediated neuromodulation in prefrontal cortex of fragile X mice.          Fragile X syndrome (FXS) is the most common form of inheritable mental retardation caused by transcriptional silencing of the Fmr1 gene resulting in the absence of fragile X mental retardation protein (FMRP). The role of this protein in neurons is complex and its absence gives rise to diverse alterations in neuronal function leading to neurological disorders including mental retardation, hyperactivity, cognitive impairment, obsessive-compulsive behaviour, seizure activity and autism. FMRP regulates mRNA translation at dendritic spines where synapses are formed, and thus the lack of FMRP can lead to disruptions in synaptic transmission and plasticity. Many of these neurological deficits in FXS probably involve the prefrontal cortex, and in this study, we have focused on modulatory actions of dopamine in the medial prefrontal cortex. Our data indicate that dopamine produces a long-lasting enhancement of evoked inhibitory postsynaptic currents (IPSCs) mediated by D1-type receptors seen in wild-type mice; however, such enhancement is absent in the Fmr1 knock-out (Fmr1 KO) mice. The facilitation of IPSCs produced by direct cAMP stimulation was unaffected in Fmr1 KO, but D1 receptor levels were reduced in these animals. Our results show significant disruption of dopaminergic modulation of synaptic transmission in the Fmr1 KO mice and this alteration in inhibitory activity may provide insight into potential targets for the rescue of deficits associated with FXS.        
26166728	Abnormal neuronal morphology and neurochemistry in the auditory brainstem of Fmr1 knockout rats.         FMRP, Fragile X, auditory, hearing, superior olive Fragile X syndrome (FXS) is an inherited neurodevelopmental disorder affecting nearly one in 5000 newborn males and is a leading genetic cause of autism spectrum disorder. In addition to developmental delays and intellectual impairment, FXS is characterized by seizures, attention deficit, and hypersensitivity to visual, tactile and auditory stimuli. The Fmr1 gene encodes Fragile X mental retardation protein (FMRP), which is abundant in neurons, binds select mRNAs and functions as a negative regulator of mRNA translation. A deficiency in FMRP, as in FXS and Fmr1 knockout (KO) animals, results in neuronal dysmorphology and altered synaptic function. Additionally, there is evidence for disruption of GABAergic circuits in subjects lacking FMRP. Our previous studies demonstrated widespread expression of FMRP in human auditory brainstem neurons. Given this observation, we hypothesized that FMRP is highly expressed in rat auditory brainstem neurons and that the auditory hypersensitivity characteristic of FXS results from dysfunction of brainstem networks secondary to decreased expression of FMRP. In our investigation of postnatal day 50 (P50) control rats, we found that FMRP was widely expressed in neurons of the superior olivary complex (SOC). In P50 Fmr1 KO rats, many SOC neurons had a smaller soma when compared to controls, indicative of abnormal neuronal morphology. Additionally, neurons in the medial superior olive (MSO) were more round in Fmr1 KO rats. There was also reduced expression of glutamic acid decarboxylase (GAD67) in neurons of the superior paraolivary nucleus (SPON) and a reduction in the number of calretinin-immunoreactive terminals associated with neurons of the medial nucleus of the trapezoid body (MNTB). Together, these findings support the conclusion that the auditory dysfunction characteristic of FXS arises, at least in part, from defective brainstem networks.           
26190969	In vivo synaptic transmission and morphology in mouse models of Tuberous sclerosis, Fragile X syndrome, Neurofibromatosis type 1, and Costello syndrome.         autism spectrum disorders, calyx of Held, intellectual disability, juxtacellular recording, mTOR signaling cascade, short-term plasticity, synaptic morphology, synaptic transmission Defects in the rat sarcoma viral oncogene homolog (Ras)/extracellular-signal-regulated kinase and the phosphatidylinositol 3-kinase-mammalian target of rapamycin (mTOR) signaling pathways are responsible for several neurodevelopmental disorders. These disorders are an important cause for intellectual disability; additional manifestations include autism spectrum disorder, seizures, and brain malformations. Changes in synaptic function are thought to underlie the neurological conditions associated with these syndromes. We therefore studied morphology and in vivo synaptic transmission of the calyx of Held synapse, a relay synapse in the medial nucleus of the trapezoid body (MNTB) of the auditory brainstem, in mouse models of tuberous sclerosis complex (TSC), Fragile X syndrome (FXS), Neurofibromatosis type 1 (NF1), and Costello syndrome. Calyces from both Tsc1(+/-) and from Fmr1 knock-out (KO) mice showed increased volume and surface area compared to wild-type (WT) controls. In addition, in Fmr1 KO animals a larger fraction of calyces showed complex morphology. In MNTB principal neurons of Nf1 (+/) (-) mice the average delay between EPSPs and APs was slightly smaller compared to WT controls, which could indicate an increased excitability. Otherwise, no obvious changes in synaptic transmission, or short-term plasticity were observed during juxtacellular recordings in any of the four lines. Our results in these four mutants thus indicate that abnormalities of mTOR or Ras signaling do not necessarily result in changes in in vivo synaptic transmission.         
